Ohne Witz, das ist ein reales Problem.
Jessica, das war spitze
Jetzt sind einige Jahrzehnte vergangen.
Gilman hat klar gewonnen.
Fragen Sie sie!
Sie ritten elegant nebeneinander.
Lukas kommt langsam in den Stimmbruch.
Sie liebkoste ihn.
Wir machen nur einen ersten Schritt.
Haltet mir den Weg frei!
Es ist in diesen Dingen souverän.
Karsten ist ein attraktiver Name.
Garde-Grenadier-Regiment „Königin“.
Dafür gebührt ihr doppelter Dank.
Er lehnte Autoritäten ab.
Nach dem Sammeln erfolgt der Einzug.
Kannst du dich um deine Dinge kümmern?
Wahlkreis Gifu gewählt.
Shea wurde in Ontario geboren.
Dem kann ich nur zustimmen.
Also, wie sieht der Masterplan aus?
Peterson erliegt seinen Verletzungen.
Da beißt sich die Katze in den Schwanz.
Karl Theodor ernannte ihn zum Hofmaler.
Er hatte nie genug davon, zuzusehen.
Aber wir hätten mehr erreichen können.
Von Janes Flug.
Giresunspor ist die Heimmannschaft.
Louderback wurde am Telefon gezeigt.
Sie gehört zum Amt Breitenfelde.
Darum ging es hier!
Das ist ein Hohn.
Gibt es neue Nachrichten aus Hattingen?
Alarmanlage einschalten.
Chor a-cappella, Op.
Welche Termine liegen nächste Woche an?
Acar ist ein türkischer Name.
"Die Anteile der """"Broadcom Ltd."
Eine Ableitung von latein.
Das ist eine Fehlinterpretation.
Da kann man nichts machen.
Ein schönes Geschäft, dieser Verkehr!
Die Erde ist politisch geeint.
Der Malte ist im Krankenhaus.
Ich danke auch Herrn Spencer.
Jude und Sue bekommen zwei Kinder.
Warum regen Sie sich so auf?
Ich bin kein Straßburg-Gegner.
Er ist in Reno, Nevada, begraben.
Ich möchte drei Anmerkungen vorbringen.
Dieser ist wie folgt definiert.
Ausgangspunkt ist die leere Saite.
Dies dauerte, bis das Schiff kam.
Sie bleiben Lippenbekenntnisse.
Was kann und sollte die Kommission tun?
Besser spät als nie, Herr Präsident.
Vielen Dank, Herr Imaz.
Vielleicht wäre es für alle das Beste.
Wir brauchen die Vereinssolidarität.
Im Moment wird das Produkt geerntet.
Er hatte einen Sohn und vier Töchter.
Phokas war.
Kunibert“ zu Ehren der hl.
Etappe des Volvo Ocean Race.
Üblich ist heute ein Geviert.
Flügel und Schwanz sind abgerundet.
Das Dorf liegt nahe am Starnberger See.
Hier entsteht ein Trugbild.
Seine genaue Ursache ist unbekannt.
Papa, wann sind wir da?
Es wird euch gefallen.
Kreisstadt war Delitzsch.
Kommen wir also gleich zur Sache.
Die Gram-Färbung verläuft positiv.
Ist Commen Voice zusammengebrochen?
Thal lebt in New York City.
Irgendwie riecht es hier verbrannt.
Your destiny is in your hands.
New Super Mario Bros.
Was nicht sein darf, ist nicht!
Für mich passt das alles.
Ole macht gerade seinen Tauchschein.
Das ist Amtsanmaßung!
Diese finden sich auf dem X-Chromosom.
Er bringt ihr Lesen und Schreiben bei.
Da musste durch.
Ich muss das gleich mal recherchieren.
Na endlich, das Ordnungsamt ist da!
Das Auto musste Ralf alleine laden.
Komm ich mach dir ein Sandwich.
Das wäre doch nicht nötig gewesen.
Der Deutsche denkt fieberhaft nach.
Kennt ihr den Weg?
Um wie viele Millionen geht es?
Folgen Sie mir unauffällig.
Der Umkehrschluss gilt jedoch nicht.
Das Gutshaus existiert nicht mehr.
Wer ist eigentlich diese Agathe Bauer?
Ich bleibe dabei.
Branko Elsner wurde sein Nachfolger.
Warum etwas komplett Neues erfinden?
Er kehrte nach Leipzig zurück.
Der Berg liegt auf einer Halbinsel.
Das Geld wird sichergestellt.
Diese haben keine Chance mehr.
Beide Werke sind verschollen.
Davon machte der Gesetzgeber Gebrauch.
Nerra von Anjou.
Ihr könnt mich töten.
Live kompatibel.
Heute beherbergt sie einen Spielkreis.
Er konnte nun neue Aufgaben übernehmen.
Wilhelm von Oechelhäuser jun.
Er ist der Sohn von Hagen Stamm.
Heute arbeitet er als Spielerberater.
"Die Führung des Zusatzes """"a."
Er wurde von Breda in Mailand gebaut.
Er ist somit hoch spezialisiert.
Sie war eine Reichsbehörde.
Gruppe des Geschwaders.
Bundesliga geglückt ist.
Der Film lag als “Prostitution.
Dann stoppte sie.
Deren Sitz war Kanazawa.
"Die """"Wikimedia Foundation Inc."
Die Höhe der Zuwendung kann max.
Lasst es krachen!
Er war auch Kapitän der Mannschaft.
Erster Vorstand ist Helga Schmelzer.
Die Raphe ist verzweigt.
Nebenblätter sind meist vorhanden.
Dessen Gattin, die hl.
Verwaltungssitz war Weymouth.
Aber auch die steht heute nicht mehr.
Die Farben des Ortes sind: Gelb-Grün.
Kreisstadt war Neustadt im Odenwald.
Erinnerungen daran.
Das Todesdatum ist daher offen.
Hansa bestellt.
Christ, zur Welt.
Tschechisch Schlesien
In Dänemark entstanden erste Aufnahmen.
Die Kronblätter sind meist genagelt.
Er spielt zurzeit in der dritten Liga.
Platz abrutschen ließen.
"Die damalige Plattenfirma von """"Wham!"
Knie ist zum dritten Mal verheiratet.
Fünf oder lieber sechs?
Hat Opencast Korrekturfunktionen?
Hat es geregnet?
Es ist von ihr kaum etwas bekannt.
Ackermann ist ledig und hat einen Sohn.
Das tun wir nämlich.
Insgesamt sind nur vier Funde belegt.
Nach seinem Studium promovierte er.
Liga umfasst.
Die Art wird zweijährig kultiviert.
Beide Flüsse münden im Po.
Die Vase wurde in Tarent gefunden.
Das Spiel ähnelt dem Cricket.
Davon zeugen zahlreiche Bodenfunde.
Daneben brauchen wir mehr Wettbewerb.
Dafür herzlichen Dank.
Keine leichte Aufgabe für Tracy.
Guten Morgen, meine Damen und Herren!
Eine maligne Entartung kommt nicht vor.
Legt euch noch mal richtig ins Zeug!
Sein Bataillon wurde aufgerieben.
"Monrose traten mit ""Do That Dance"" auf."
Ansonsten können wir uns das sparen.
Klasse, der späteren Landesliga.
Max Bodenstein wurde sein Doktorvater.
Ein Exemplar existiert noch.
Wer die Frau ist, weiß man nicht.
Sie ist Teil der Finanzmarktaufsicht.
Sie sind alle von der Krise betroffen.
Sie haben keine Afterflosse.
Er rannte hysterisch von Dorf zu Dorf.
Einen Mittelweg gibt es nicht.
Da machen wir nicht mit.
Das hat natürlich keinen Sinn.
Es gab also durchaus Reaktionen.
Der Körper der Männchen ist blau.
Als Ruheständler lebte er in Künzelsau.
An der Alma wurde Evans verwundet.
Genau darum geht es, Herr Barroso!
Das wurde auch Zeit und war nötig.
Sie gewann das Finale.
Es war nur eine Schutzmauer vorhanden.
Dazu werden Salzkartoffeln serviert.
Hier waren die Preise extrem günstig.
Die ganze Insel ist ein Nationalpark.
Kerngeschäft war der Handel mit Wolle.
Sie gehörten zur Familie von Walsleben.
Ja, schon irgendwie.
Caproni blieb jedoch Produktionsleiter.
Sie ist mehrmals zerstört worden.
Es nahmen zehn Mannschaften teil.
Steinheil folgt jedoch einem Gauß-Typ.
Sie durchfließt Ottobeuren.
Er ist Schutzpatron des Bistums Chur.
Gauhauptstadt war Innsbruck.
Es handelt sich um ein redendes Wappen.
Na gut, lass uns drüber reden.
Er war ein schlechter Schüler.
Das ist eine Grundvoraussetzung.
Das kratzt sicherlich an seinem Ego.
Schmeckt irgendwie nach Kürbis, oder?
Oder etwa nicht?
Zieht jetzt endlich eure Schuhe an.
Woher kommt all der Hass?
Bezirk, Donaustadt, nach ihr benannt.
Der Friedhof wird weiterhin genutzt.
Hier sind drei Phasen zu unterscheiden.
So drei bis vier Jahre, schätze ich.
Es findet Windbestäubung statt.
Weite Gebiete sind versumpft.
Eine Beleuchtung ist vorgeschrieben.
Ob dies gelingt, bleibt abzuwarten.
Sprecher ist erneut David Attenborough.
Sie müssen daher isoliert werden.
Auftritt im Hotel Kempinski Berlin.
Als Besonderheit ist er vorne offen.
Die Strecke war sehr schnell.
Esau lernt schnell zu gehorchen.
Reserve-Korps ernannt.
Der Ort wurde neu besiedelt.
Venus und Adonis in Umarmung.
Kindermann war bald rehabilitiert.
Regionalliga Nord.
Golfkrieges aufgegeben.
Ausnahmen finden sich in der Biochemie.
Die Hauptstadt ist Palencia.
Eleonore von Merlau verließ die Stadt.
Staffel dieser Sendereihe.
Vielen Dank, das genügt.
Dem kann ich ebenfalls nur zustimmen.
Verhält es sich nicht so?
Und Pan Tau kann zaubern.
Er hatte sieben Geschwister.
Ridgway lebt derzeit in London.
Papst Silvester“ ernannt.
Studioalbum der Gruppe.
Das Urteil ist damit rechtskräftig.
Diana Eichhorn wuchs in Düren auf.
Dieses Vorhaben zerschlug sich aber.
Spieltag drei Tore.
Die Kapelle ist unter der lfd.
Trotz ihres Erfolges blieb sie arm.
Ein Jahr später stieg die Admira ab.
Klein lebt und arbeitet in Köln.
Er hatte einen Bruder namens István.
Er war Ältermann der Schonenfahrer.
Breitengrades kreuzen sollten.
Auffallend ist die große Afterflosse.
Hinzu kommen Auftragsmörder.
Massentourismus gibt es also kaum.
Hans Riehl war sein Halbbruder.
Ein Sohn sowie fünf Töchter.
Die Auswahl enthält keine Rangordnung.
Sein Gegner war Alfredo Angulo.
Er wurde Mitglied im Soldatenrat Halle.
Auch in Harrachov war er erfolgreich.
Garde-Regiments zu Fuß.
Die Postanschrift lautet: Mainzer Str.
Auch das Interieur wurde überarbeitet.
Wolf blieb unverheiratet.
Das Unterfeuer zeigte ein rotes Licht.
Der Blütenstand ist pyramidal.
Regenzeit ist im März.
Trotzdem galt er noch als fischreich.
Die Bauern erschlagen auch ihre Mütter.
Beispiel ist die Kartoffel.
Die Berliner Musiker Egotronic feat.
Infanterie-Division gehörte.
Zunächst stand er auf Perseus' Seite.
Der Sitz war in Kiel.
Zu letzteren gehören bspw.
Es geht uns um die Sicherheit.
Dies ist nicht meine Meinung.
Es gibt jetzt keine Mitteilung!
Sie gehört zum Amt Jarmen-Tutow.
Sie findet stets ein großes Presseecho.
Der Flug dauerte zehn Tage.
Das Fernsehen soll live übertragen.
Den Speerwurf dominierten die Finnen.
Wächst die Last, steigt auch der Druck.
Crettenand-Moretti lebt in Zinal.
Staffel einen Gastauftritt.
Erstens die Türkei.
Dennoch habe ich einige Anmerkungen.
Die Brust ist schwach grau gestrichelt.
Über seine Jugend ist wenig bekannt.
Ihr Nachfolger wurde Helmut Göschel.
Hier ist es sicherer.
Ihr steht auch etwas von der Marge zu.
Hallo, ist da wer?
Zum Souffle gehört Vanillesoße.
Wir werden ihn schmerzlich vermissen.
Nichts änderte sich daraufhin.
Die Nummer war sicher eingeübt.
Ich mag rote Rosen und Narzissen.
Das Gefieder ist überwiegend grau.
Deutschen Meistertitel.
Der Kanal ist noch voll betriebsfähig.
Unitas Rheinpfalz, München.
Ja ja, das Publikum fordert immer viel.
Die Krankheitsursache ist unbekannt.
"Mit seiner Frau """"Olga geb."
Zudem lag der Kessel höher.
Der Sitz ist Berlin.
Er wurde von Brooks Stevens entworfen.
Sie hat vier Kinder.
Basketball” geehrt wurde.
Dies wandelte sich mit der Zeit.
Sie haben gut entwickelte Saugrüssel.
Dies wissen auch die Vögel.
Er isst einfach nie normal Frühstück.
Meines Wissens habe ich es nie gehört.
Das sollte er tun.
Minihan wurde in Pampa, Texas, geboren.
Gefilmt wurde in Snowdonia, Nordwales.
Diese Vereinbarung hielt nur ein Jahr.
Es gehört zur Metropole Messina.
Sein Nachfolger wurde Karl Gerland.
"Artikel in der ""Zeit"" zum Thema"
Korps übernahm.
Ich werde mein Bestes versuchen.
Diese Offerte wurde jedoch abgelehnt.
Oder eine Nutzerin!
Davor ziehe ich den Hut.
Ihre Tante war Lady Jane Grey.
Der Ehe entsprangen neun Kinder.
Keiner von beiden war William.
Das ist einfach nicht tragbar!
Zusammen hatten sie eine Tochter.
Staatseisenbahnen ausgeliefert.
Können Sie das tun?
Ihre Eltern waren Zirkusartisten.
Physikalischen Institut.
Deutsche Gesellschaft für Ästhetik.
Earl of Moray.
Man spricht von der Tarifautonomie.
Die Krise schwächte die Partei.
Stellvertretende Gauleiter waren
Verwaltungssitz ist Bitburg.
Erlösers erbaut habe.
Hannover, Fakultät Soziologie.
Die Klamm wird kommerziell genutzt.
Die Einwohnerzahl ging deutlich zurück.
Wiener Gemeindebezirk Meidling.
Ist der Kugelschreiber blau?
Größte Stadt ist Pilsen.
Die Abbildung zeigt das Y-Chromosom.
Sie ist nackt.
Urd steht für die Vergangenheit.
Tarassowa war dreimal verheiratet.
Platz in der Scorerwertung einbrachte.
Die Bank hatte nun zwei Möglichkeiten.
Zentrum der österr.
Frankreich blieb seine Wahlheimat.
Er lebt und arbeitet in Hannover.
Obergeschoss zur Schau gestellt.
Air Vanuatu fliegt weiterhin.
Das habe ich alles gesehen!
Es ist eine dramatische Situation.
Also nehmen wir Barroso!
Er verletzt das Solidaritätsprinzip.
Dies ist ein riesiger Skandal!
Worum geht es in erster Linie?
Wir alle kennen dieses Bild.
Wir alle sind gebildete Leute.
Und eine große Hungersnot droht.
Ich komme noch darauf zurück.
Es war eine katalytische Neuerung.
Das muss höchste Priorität haben.
Ich hoffe, das wird nicht verwässert.
Ich gebe das Geld aus.
Davon ist er weit entfernt.
Möge Amerika auf sie hören!
So etwas gibt es einfach nicht.
Auch darauf müssen wir hinweisen.
Es ist wie ein kleiner Krieg.
Sie schließen einander nicht aus.
Sie selbst haben dies bestätigt.
Lebensjahr in Salzburg.
Er gehörte der liberalen Fraktion an.
Im Westen liegen Guinea und Liberia.
Wenige Tage später wurde Berg entführt.
Rocket spielte.
Dabei handelte es sich um Slicks.
Astronautengruppe beworben.
Stammbaum der Häuser Lancaster und York
Derzeit lebt sie in Kent.
Webseite von Marchesi Antinori
Ende der geplanten Erklärung.-
Was werden Sie tun?
Zu den Interessenkonflikten.
Lassen Sie es uns ganz deutlich machen.
Das war das einzige Land!
"Sein Spitzname ist ""Godzilla""."
Yates basiert.
Bundesliga war geschafft.
Dreifaltigkeit genutzt.
Er verweigerte den Kriegsdienst.
Sinfonie zu hören ist.
Ziel war die europäische Westfront.
Die Krone ist gelblichweiß.
Diese mündete kurz darauf in die Linth.
Sein Nachfolger ist Dennis Rödder.
Die Sängerin nahm seinen Rat an.
Er ist vollständig bewaldet.
So muss es auch diesmal sein.
Sie sind jedoch ähnlich.
Die Drescher sind erwachsene Männer.
Die Passform war noch eher schlecht.
Hierbei gibt es jedoch ein Problem.
Aber das war es dann auch schon wieder.
Es dauert nur drei bis vier Sekunden.
Ihr Partner war Matthias Bleyer.
Aber etwas müssen sie tun.
Wir dürfen nicht schweigen!
Sie spielten dynamischen Punk.
Die Vereinsfarben sind gelb und blau.
Sie war wie er sehr zurückhaltend.
Das ist eine offene Debatte.
Ursache dafür ist die Corioliskraft.
Die Aurora bedeutet Matt alles.
Die Regie hatte Götz Fritsch.
Sommer war zwei mal verheiratet.
Wir müssen nur auf die Karte sehen.
Jerrold mietete das Flugzeug.
Eine weitere Pflege ist nicht nötig.
Laut Cassius Dio war er Freigelassener.
Das Ehepaar hat keine Kinder.
Der Boden ist etwas mit Torf bedeckt.
Verstehen Sie auch das Gesprochene?
Die Scheibe ist dunkelblau.
Mutterschaft hat praktisch keinen Wert.
Das ist absolut wichtig.
Ich habe das prüfen lassen.
Das ist der Hauptgrund.
Dies ist ein sehr wichtiger Bereich.
Auf Wiedersehen, Giscard d'Estaing.
Solche Staaten gibt es immer noch.
Wer ist die Entscheidungsinstanz?
Ich möchte nur drei herausgreifen.
Es hängt davon ab, wie man es sieht.
Und die Griechen?
Darauf muss ich Sie hinweisen.
Das ist also keine so hohe Summe.
Vielen Dank, Herr Colom i Naval.
Danke, Frau Oomen-Ruijten.
Trauen wir uns, denn Thailand taumelt!
Vielen Dank für diese Frage, Herr Bowe.
Das ist ihre klare Antwort.
Damit bin ich beim Hauptproblem.
Es gibt keine Projekte ohne Risiken.
Aber was haben wir seitdem gesehen?
Ich freue mich auf unsere Debatte.
Dies ist ein schwieriges Thema.
Diese Richtlinie ist ausgewogen.
Ich habe viel dabei gelernt.
Bitte starten Sie die Vorführung.
Hoffentlich kommt sie zur rechten Zeit.
Dieser Weg ist noch immer nicht leicht.
Davon bin ich fest überzeugt.
Die Vergangenheit ist nicht tot.
Wir unterstützen die Entschließungen.
Hier besteht ein deutliches Defizit.
Soweit dazu.
Es geht hier um die Bananen.
Mir geht es wie Herrn Ephremidis.
Sie sind sehr willkommen.
Wenn ja, was wurde gesagt?
Das ist reiner Hass.
Ich unterstütze den Bericht.
Mir ist kein Ergebnis bekannt.
Da müsste ich jetzt auch sein.
Das wissen Sie.
Sie sind gemeinsam verantwortlich.
Die Spannung ist kaum noch auszuhalten.
Was geschieht mit dem Geld?
Dazu sind wir verpflichtet.
Kommissar Verheugen!
Ist das annehmbar?
Das ist uns zu ungenau.
Auch im Ruhestand publiziert er weiter.
Die Zulassung erhielt es Ende November.
Holz und Biberpelz sind gestohlen.
Allerdings wird versucht, eine evtl.
Dies kam dem aber gleich.
Unterpräfektur ist Sedan.
Gabuns Handelsbilanz ist positiv.
Senats tätig wurde.
Civil-Mädchen-Pensionat ein.
Oberkopf und Hals waren rötlichbraun.
Er starb in Madrid.
Sein ständiger Wohnsitz war Klagenfurt.
Dieser Vertrag wurde nie gebrochen.
Pe erscheint oft in religiösen Texten.
"Seine Stücke """"„hamlet ist tot."
Woodward lebt in Connecticut.
Die Tiere sind polygam.
Danach arbeitete sie als Journalistin.
Er ist Mitglied der Balaton Group.
Episode abgeschlossen.
Sein Nachfolger wurde Max Reger.
Dort belegte er zuerst Pharmazie.
Daneben war er von Beruf Lehrer.
Die Augen sind grau.
Sie hatten einen Sohn: Conrad.
Dies ist kein Festtag.
Wie ich sehe, benötigt ihr Nachschub.
Auch ist davon Portugal betroffen.
Welcher Art?
Wettbewerbsfähigkeit?
Dieses Element ist wichtig.
Nein, keinesfalls.
Betrachten wir die aktuelle Situation.
Armut beeinflusst die Gesundheit.
So auch dieses Mal.
Bisweilen bezweifle ich das.
Ist das Fanatismus?
Wir wollen Beschäftigung und Wachstum.
Werden wir deregulieren?
Dort steht ein Bahnbetriebswerk.
Vorgängerin vom Kindergarten.
Die Mark Verona blieb Liutold erhalten.
Tja, so kann man sich irren.
Oha liegt im Gemeindegebiet.
Mittlerweile lebt sie in Berlin.
Amer war mit Nasser eng befreundet.
Drei Jahre später starb er.
Warum bist du immer so gemein zu mir?
Die Sache geht uns alle an.
Wir werden sehen, was das bringt.
Deshalb wünsche ich allen viel Erfolg.
Ich finde das äußerst traurig.
Das tun sie auch.
Ersteres war leichter.
Aber auch das muss gekonnt sein.
Wir heißen sie hiermit willkommen.
Was tut sie?
Wagniskapital ist Risikokapital.
Das wollte ich die Kommissarin fragen.
Unser Ausschuss meint ja.
Herr Präsident Santer!
Der Ausschuss hat anders entschieden.
Niemand kann uns diese Arbeit abnehmen.
Ich möchte Ihnen zwei Punkte vorlesen.
Das ist ein äußerst wertvoller Beitrag.
Es gibt zwei Arten von Nanotechnologie.
Er liegt natürlich auch dem Rat vor.
Genau das soll besprochen werden.
Ich hoffe, es stimmt nicht!
Vielen Dank, Herr Herman.
Ich danke für Ihre Aufmerksamkeit!
Ich möchte sie darin vermerkt haben.
Wie wird es weitergehen?
Das ist nur eine Frage der Logik.
Die Reaktionen sind sehr eindeutig.
Der zweite Punkt betrifft Alkohol.
Trotzdem habe ich Bedenken.
Das ist natürlich nicht wahr.
Es gilt, die Vorurteile abzubauen.
Wir brauchen starke europäische Organe.
Ich habe nicht daran gezweifelt.
Die Testverfahren werden immer genauer.
Etwa von der Waffenindustrie?
Hierfür gibt es Zeugen.
Ein echter Rekord!
Nach wie vor fehlt ein Gesamtkonzept.
Der Luftverkehr gehört bereits dazu.
Was sollen wir ihnen antworten?
Kommen wir nun zum nächsten Punkt.
Das ist kein Erfolg.
Ein Markt ist kein Dschungel.
Sie sind am wichtigsten.
Da kann ich Ihnen nur beipflichten.
Das kann und darf nicht geschehen.
Was tut nun eigentlich die Kommission?
Das ist ein tödlicher Kreislauf.
Bitte schauen Sie sie sich genau an.
Dies ist weder hinnehmbar noch seriös.
Ist das etwa Emily mit der Gitarre?
Der ursprüngliche Entwurf war schlecht.
Bildung ist eine europäische Aufgabe.
Der Versuch ist unternommen.
Kann man etwas dagegen unternehmen?
Es handelt sich um Menschen.
Wir haben hierzu einen Änderungsantrag.
Mögen sie den Tag festlegen.
Diese Zahl bedarf der Erklärung.
Ich kann nicht allen Rednern antworten.
Auch um der Türkei willen.
Ich bin kein bezahlter Lobbyist.
Ich möchte ihn dazu beglückwünschen.
Das wird zu prüfen sein.
Zwei Dinge möchte ich hervorheben.
Sie entstand durch Genozid.
Ich bin ja dort, ich habe da Kontakte.
Sie fühlen sich häufig nicht betroffen.
Dies ist nicht der richtige Weg.
Und worauf lief es hinaus?
Hier muss rasch gehandelt werden.
Sie benötigten keine Denkpause.
Wieso zitiert er die Verfassung?
Jetzt sehen wir das Ergebnis.
Barcelona hat zu Ergebnissen geführt.
Es ist also Zeit für eine Kursänderung.
Die Krümel kommen alle aus dem Toaster.
Die Souveränität muss geschützt werden.
Es ist Zeit zum Aufwachen!
Sie ist auch eine Krise der Werte.
Vorher hatten wir keine Chance dazu.
Willkommen im Europäischen Parlament.
Beide?
Ich habe dazu zwei Fragen.
Dies überrascht uns keineswegs.
Das ist anderthalb Jahre her.
Wir wollen, dass mehr getan wird.
Es passiert aber leider nichts.
Eine sehr kluge Entscheidung.
Können wir sie sehen?
Es waren lange, mühsame Verhandlungen.
Damit sollten wir uns einmal befassen.
Gibt es hier einen Ausweg?
Was heißt Zurückhaltung?
Das dürfte keinem verborgen bleiben.
Das sind sie aber nicht.
Absolut alle.
Das nur zur Klarstellung vorab.
Jetzt zum konkreten Problem.
Klasse besucht werden kann.
Klasse absolviert.
Funde wurden bisher nicht gemacht.
Du hast es mir nicht erzählt.
Eychaner hatte allerdings einen Plan B.
Er diente dort mehrere Jahre lang.
Was war dieses Etwas?
Bei Kriegsende war er ein Hauptmann.
Naja, hier bin ich.
Es besteht aus einem Teilskelett.
Ich kenne sie schon mein ganzes Leben.
Was verdiene ich damit?
Notieren Sie das; es ist wichtig.
Er war ein Gefährte von Bricta.
Ich habe viele transsexuelle Freunde.
Sie ist eine bemerkenswerte Kupferinuk.
Sänger singt in ein Mikrofon.
sagte ich, und nahm sie beiseite.
Es ist der Name von Bosnien.
Sie legte ihre Stirn in Falten.
Der Atco-See ist ein See in Atco.
Das ist der Vertrag?
Ihre Familie kommt aus Siebenbürgen.
Es war ein schnelles Tempo.
Was spürt man?
Überhole ihn; bring ihn sofort zurück!
Stille Nacht.
Welchen Effekt hat diese Veränderung?
Kluge „A Call From Jersey“.
Belgien schied in der Gruppenphase aus.
Kapellmeister in Wuppertal.
Gedreht wurde in Toronto, Kanada.
Eine neue Kommission ist im Amt.
Er ist einer der vierzehn Nothelfer.
"Solche ""Modifier"" sind bspw."
Ludwigsdorf grenzt an Klein Windhoek.
Partnerstädte der Stadt Pag sind
Wecker von Zweibrücken-Bitsch über.
Ist heute Schule?
Denken Sie nicht darüber nach.
Die Studie hatte viele Fehler.
Wilson ist auch Koch.
Was sagt sie dazu?
Die Wette gehe ich ein.
Der Sender gehört zum Amherst College.
In Myrdal gibt es Gütergleisanschlüsse.
Er hat noch einen Bruder, Luke.
Eine Single von Penny Broadhurst.
Derzeit sind zwei Umwandler aktiv.
Ich muss die Gebühren bitte stornieren.
Ein Typ auf einem Snowboard
Sie nimmt regelmäßig am Unterricht teil
Diese Ansprüche werden angefochten.
Wie fühlst du dich jetzt, George?
Das kann ich sehen.
Ein Tor erzielte er dabei nicht.
Sein Nachfolger wurde Ernst Ludwig.
Der Kopf der Tiere ist breit.
Bösch lebt und arbeitet in Hörbranz.
Diese Mittel wirken insektizid.
Die Polizei unternahm jedoch nichts.
Sie gehörten zum Seekreis.
Chris verliebt sich in die junge Frau.
Er empfängt mich persönlich.
Literarische Bücher
Sieben war verheiratet.
Angabe der ersten beiden Buchstaben
Führer müssen ihren eigenen entwickeln.
Zudem war er als Autor tätig.
Der Verein wurde Letzter und stieg ab.
Dort wurde er Richter am Kreisgericht.
Alle hatten Lenkradschaltung.
Das armenische Volk.
Sie ist Teil des Amtes Scharmützelsee.
In Großbritannien bewahrt die „C.
Setzen Sie auf die Zehn!
Ihr nächster Termin ist im Mai.
Donald wurde König von Schottland.
Dies ist für Sie.
Unter Androhung der Todesstrafe
Einige Männer arbeiten zusammen.
Im Film Adaptation.
Ich werde in Ihrem Namen vermitteln.
Dando wurde als Baptist erzogen.
Endraya ist die Tochter Abrahams.
Japan verwendete eine ähnliche Methode.
Es war Geld – immer war es Geld.
Er atmete schwer.
Sie werden kein Zitat von mir bekommen.
Die Heffer hatten keine Kinder.
Lee ist ein typischer Blue-Chip.
Haben Sie einen Spiegel?
Ein Künstler führt Tonarbeiten aus.
Meine jungen Freunde haben es eilig.
Kind entdeckt neue Welt
Eine Frau steht in Aberdeen.
Tims Schwester Sylvie beschützt ihn.
Olivet-Friedhof, Salzsee-Stadt, Utah.
Dem Burschen schreibe ich.
Seine Mutter war Klavierlehrerin.
Er ist ein Erdbeben-Dämon.
Auch für den britischen Sender Kerrang!
Das Innere ist auffallend dunkel.
Platz ebenfalls die Top Ten.
Was aber meinen sie eigentlich damit?
Schluß mit lustig.
Die Ethik wird nur am Rande behandelt.
"Staffel der Serie ""Smallville""."
Seine Mutter, Maria Dingler geb.
Das Nutzungsentgelt wird erhoben
Kolonie vereinnahmen zu können.
Seither sitzt Julian am Schlagzeug.
Das Bild zeigt eine Kreuzigungsszene.
Die Reihe spielte in Lübeck.
Pionier-Korps nach Mexiko.
Dabei treten sehr selten Blutungen auf.
Rank entwarf und ausführte.
Palästinensischen Brigade.
"Tambourine Man"""" schrieb."
Die Stadt war nicht befestigt.
Kann ich mit Rena sprechen?
Wir müssen ein Konzept entwickeln.
Die Wahl fiel auf Valencia.
Dazu wollen wir alle beitragen.
Motors Ltd.
Howard zog es nie nach Los Angeles.
Inka die Herrschaft des Reiches.
Auf wird jedoch verzichtet.
Der Österreicher Johannes Eder gab auf.
Peoria ist Sitz eines Bezirksgerichts.
Von Crouch selbst fehlt jede Spur.
Hoflieferant wurde.
Webseite des Museums
Media Lab und am Smithsonian Institut.
Überall wird hier gebaut.
Noch tappen die Ermittler im Dunkeln.
Lasst eurer Fantasie freien Lauf!
Zeig uns mal, wo der Hammer hängt!
Erst dann versinken sie.
Man unterscheidet Masken und Folien.
Daher müssen wir proaktiv handeln.
Beide Orte bilden baulich eine Einheit.
Die Unfallzahlen blieben gleich.
Er schloss als Diplom-Biologe ab.
So hat er das nicht gemeint.
Dies ist meine Antwort.
Wie ist der Staat Israel entstanden?
Wiener Gemeindebezirks, Neubau.
Die Mozer Process Technology Pvt.
Die Stephenson-Steuerung lag innen.
Dabei entdeckte er den Blinden Fleck.
Was dies bedeutet, ist unklar.
"Ordnung"""" begründete."
Also gut!
Also wir beginnen nicht bei Null.
Genau hier liegt der Knackpunkt.
Diese Aussicht freut mich.
Herr Bösch hat das vorgelegt.
Da werden jetzt die Spanier kommen.
Natürlich ist Werbung nicht alles.
Das ist meistens miteinander verbunden.
Vielen Dank, Herr Alyssandrakis.
Was machst du Freitag?
Sie haben das Wort, Frau Cresson.
Der russische Staat aber ist schwach.
Mit der Bahn ist das zu weit.
Wie lange wird das noch so weitergehen?
Deauville war ein Fehler.
Wir sind nicht Teil der Exekutive.
Das ist ihr einziges Kriterium!
Weshalb brauchen wir es?
Das ist die Wirklichkeit heute.
Ein Taler entsprach drei Mark.
